{
  "id": "vnf2",
  "vendor": "netgroup",
  "descriptor_version": "0.1",
  "version": "0.1",

  "vdu": [
    {
      "id": "vdu21",
      "computation_requirement": "",
      "virtual_memory_resource_element": "",
      "virtual_network_bandwidth_resource": "",
      "vnfc": [
        {
          "id": "vnfc21",
          "connection_point": [
            {
              "id": "cp22",
              "virtual_link_reference": "vl21",
              "type": "NIC"
            }
          ]

        },
        {
          "id": "vnfc22",
          "connection_point": [
            {
              "id": "cp23",
              "virtual_link_reference": "vl21",
              "type": "NIC"
            }
          ]

        },
        {
          "id": "vnfc23",
          "connection_point": [
            {
              "id": "cp24",
              "virtual_link_reference": "vl21",
              "type": "NIC"
            }
          ]

        }
      ]
    }
  ],
  "virtual_link": [{
      "id": "vl21",
      "connectivity_type": " E-Line",
      "connection_points_references": [
        "cp21",
        "cp22",
        "cp23",
        "cp24"
      ],
      "root_requirement": ""

    }
  ],
  "connection_point": [
    {
      "id": "cp21",
      "type": "",
      "virtual_link_reference": "vl21"
    }
  ]
}